Title,First air date,End date,Rating,Genres,Status,Network,Summary,Web Channel,Language,Runtime,Premiered Year
Ghosts of Time,2012/09/24,2012/12/29,4.8,"[""Children"", ""Supernatural""]",Ended,Seven Network,"Ghosts of Time follows 4 kids who meet Theo, a mischievous and eccentric old ghost. He's trapped in his derelict mansion unless he returns his stolen antiques to the rightful owners he stole them from in the first place. Whenever the kids and Theo touch the stolen antique, they…",,English,30,2012
Chains of Heart,2023/02/18,2023/04/22,7.1,"[""Drama"", ""Action"", ""Romance""]",Ended,Channel 3,"Ken survived an incident in which Din, his lover, was shot dead in front of him by Nok and his men in the middle of a forest in Uttaradit. After that, Ken manages to escape and settle down as an assistant chef at a 3- Michelin-starred Chinese restaurant with Pa, Ken's father in…",,Thai,60,2023
When the Stars Gossip,2025/01/04,2025/02/23,5.6,"[""Drama"", ""Romance"", ""Science-Fiction""]",Ended,tvN,"From two different worlds and with separate missions, an astronaut and a space tourist entangle in space — only to start falling for each other.",,Korean,,2025
Timeless Tales from Hallmark,1990/09/27,1991/09/26,5.8,"[""Children"", ""Fantasy"", ""Music""]",Ended,USA Network,Animated adaptations of famous fairy tales.,,English,30,1990
"Youth, Climb the Barrier",2023/02/06,2023/04/11,7.8,"[""Romance""]",Ended,tvN,"A story about a prince who receives a book about ghost stories containing all kinds of curses of life and feels that the curse is happening one by one,and a woman who became a wanted murdered who betrayed her marriage, and how they save each other from each other's fate.",,Korean,,2023
My Tooth Your Love,2022/10/14,2022/12/20,7.8,"[""Drama"", ""Comedy"", ""Romance""]",Ended,LINE TV,"Bai Lang is a bar-restaurant owner with an all-too-familiar phobia. Ever since he was a young child, he has dreaded having to go to the dentist. And although he has tried countless times to change dentist in search of someone who does not fill him with dread, nothing frightens h…",LINE TV,Chinese,,2022
Dinner with the Parents,2024/04/18,2024/05/09,3.9,"[""Comedy"", ""Family""]",Ended,Amazon Freevee,"Based on the successful British comedy Friday Night Dinner, Dinner with the Parents centers around a weekly family get-together that always devolves into chaos. Every Friday evening, the closely-knit Langers prove that it takes those we love best to bring out our worst.",Amazon Freevee,English,,2024
Eternal Yesterday,2022/10/21,2022/12/09,6.7,"[""Drama"", ""Romance""]",Ended,MBS,"Koichi, who is cheerful and popular in the class, and Mitsuru, who is talented and not good at socializing. The two high school students are strongly attracted to each other due to their opposite personalities. However, one morning, Koichi is hit by a truck in front of Mitsuru.…",,Japanese,30,2022
Moving,2023/08/09,,7.2,"[""Drama"", ""Action"", ""Fantasy""]",To Be Determined,Disney+,"Set in modern-day Korea, Moving tells the story of a group of superpowered individuals who hide their true abilities from the world in order to protect their families from harm and exploitation.",Disney+,Korean,,2023
The Playlist,2022/10/13,2022/10/13,7.5,"[""Drama"", ""Music""]",Ended,Netflix,"In this fictionalized account, a Swedish tech entrepreneur and his partners set out to revolutionize the music industry with a legal streaming platform. Led by Daniel Ek, a group of passionate young entrepreneurs come together in what seems to be the impossible task to change th…",Netflix,Swedish,,2022
Khun Chai,2022/10/03,2022/11/28,6.3,"[""Drama"", ""Romance"", ""History""]",Ended,One31,"This is a story of a family's heir, carrying hope of family on the shoulders. His life has already been designed and there are rules to follow. He can't do what he wants and he can't love who he wants either. Tian and Yang are sons of Song Family, a member of Five Dragons Group.…",,Thai,90,2022
Rivals,2024/10/18,,6.4,"[""Drama"", ""Romance""]",Running,Disney+,"Rivals dives headfirst into the cut-throat world of independent television in 1986, where the shoulder pads are big and ambitions even bigger. In the fictional upper-class county of Rutshire, a long-standing rivalry between two powerful men is about to boil over: ex-Olympian, Me…",Disney+,English,,2024
My Lady Jane,2024/06/27,2024/06/27,7.2,"[""Comedy"", ""Fantasy"", ""Romance""]",Ended,Prime Video,"Are you ready for an epic tale of true love, high adventure, regicidal maniacs, deadpan heroism, devious intrigues, swashbuckling swordfights, a soupçon of magical realism and oodles of yearning, banter and undeniable chemistry? Of course you are. Welcome to My Lady Jane.",Prime Video,English,,2024
Connect,2022/12/07,2022/12/07,7.0,"[""Mystery""]",Ended,Disney+,A mysterious story that takes place when a man who has lost a part of his body to organ hunters is 'connected' with a person who received an organ transplant.,Disney+,Korean,,2022
Kabe-Koji-Nekoyashiki-kun Desires to be Recognized,2022/10/03,2022/11/21,7.8,"[""Comedy"", ""Romance""]",Ended,ABC,Mamoru Nekoyashiki is a reclusive artist who makes doujinshi works: fan-created or self-published works. He has created a BL-themed manga series that he dreams of being able to sell in a special section for popular doujinshi titles in bookstores. Only a select few doujinshi arti…,,Japanese,30,2022
Yalı Çapkını,2022/09/23,2025/04/04,5.9,"[""Drama""]",Ended,Star TV,"Ferit, the son of a wealthy family, is a womanizer. To get rid of his flirtatious ways, his grandfather Halis Ağa decides to marry him to the daughter of a close family from Gaziantep.",,Turkish,150,2022
Remember Me,2022/10/09,2023/01/08,6.7,"[""Drama"", ""Romance""]",Ended,Amarin TV,"Are you still able to recall those nostalgic days when you'd anxiously anticipate that much-awaited reply from the one you loved? Handwritten letters. MSN Messenger. Blackberry. LINE. Even though times have changed, messages have always allowed us to convey our feelings of love.…",,Thai,60,2022
Big Dragon,2022/10/08,2022/11/26,7.7,"[""Drama"", ""Romance""]",Ended,One31,"After a wild, passionate night at a bar, Mangkorn and Yai's fate becomes inseparably intertwined. Yai, the owner of the bar, decides to completely renovate the place so that he can erase the memories of the sinful night. But it just so happens that the designer in charge of the…",,Thai,60,2022
Marvel Studios' Special Presentation,2022/10/07,,7.6,"[""Science-Fiction""]",Running,Disney+,A series of special one offs from Marvel Studios.,Disney+,English,,2022
Conversations with a Killer: The Jeffrey Dahmer Tapes,2022/10/07,2022/10/07,7.0,"[""Crime""]",Ended,Netflix,"Serial killer Jeffrey Dahmer confesses to his gruesome crimes in unguarded interviews, offering an unsettling view into a disturbed mind.",Netflix,English,,2022
Momgap,2022/10/28,2022/11/04,7.7,"[""Drama"", ""Thriller""]",Ended,TVING,A disaster-thriller that unfolds after a major earthquake hits a building where ransom bargaining for various reasons took place. It depicts the merciless struggle of human beings to survive in the chaos created by complete disconnection from the outside world.,TVING,Korean,40,2022
Weak Hero: Class 1,2022/11/18,,7.8,"[""Action"", ""Crime""]",Running,Netflix,"An action growth drama about Yun Shi Eun, a model student with grades belonging in the school's top 1%. He looks weak but he fights against numerous violence inside and outside of the school. It depicts a naturally weak boy in terms of appearance, overpowering a jungle-like scho…",Netflix,Korean,,2022
Dope Thief,2025/03/14,,7.2,"[""Drama"", ""Crime""]",To Be Determined,Apple TV,"Two lifelong friends from Philadelphia pose as DEA agents to rob a country house, but the small-scale grift quickly becomes a matter of life and death. The friends soon unravel as they find one of the biggest narcotics corridors on the East Coast.",Apple TV,English,,2025
Farmer Wants a Wife,2023/03/08,,7.2,"[""Romance""]",To Be Determined,FOX,"Four farmers from across the country embark on an adventure of a lifetime in the hopes of finding their future spouse. Women will leave behind the dating apps and pursuit of love in ""the big city"" in favor of classic American courtship. The farmers will take their group of dater…",,English,60,2023
House of Ninjas,2024/02/15,,7.2,"[""Drama"", ""Action""]",To Be Determined,Netflix,"Ninjas were a fixture of milestones in Japanese history, and even now they're taking on secret missions behind the curtain of Japanese society. Set in modern Japan, House of Ninjas tells the story of the Tawara family, the last ninja family that had abandoned its roots after a c…",Netflix,Japanese,,2024
The Mole,2022/10/07,,7.3,"[""Adventure"", ""Mystery""]",Running,Netflix,Twelve players complete challenges while trying to identify the one among them who's sabotaging their missions in this reboot of the cult-classic series.,Netflix,English,,2022
Beast Tamer,2022/10/02,2022/12/24,5.3,"[""Comedy"", ""Adventure"", ""Anime"", ""Fantasy""]",Ended,Crunchyroll,"The story follows beast tamer Rein, who is banished from the hero's party, because he can only use animals. He becomes an adventurer and meets a cat girl, who is part of the strongest species.",Crunchyroll,Japanese,24,2022
Spirit Rangers,2022/10/10,,7.3,"[""Adventure"", ""Children"", ""Music""]",To Be Determined,Netflix,"Inspired by stories from Native American tribes and the majestic landscapes of national parks of America, Spirit Rangers explores the adventure and beauty of nature through the eyes of Kodi, Summer and Eddy Skycedar, Chumash/Cowlitz siblings who share a secret. This trio of kids…",Netflix,English,,2022
Sagrada familia,2022/10/14,2023/11/17,6.0,"[""Drama"", ""Thriller""]",Ended,Netflix,"A family hiding a shocking secret starts over in Madrid, where new relationships complicate their plans and the past begins to catch up with them.",Netflix,Spanish,,2022
Монастырь,2022/11/19,,7.4,"[""Drama""]",Running,КиноПоиск,"Maria is a charming party girl who lives at the expense of others. Once in the Emirates, she goes to a nightclub with the wife of a billionaire, the party gets out of hand, and now Maria is facing prison, dangerous people are chasing her, and her accounts are blocked. She has to…",КиноПоиск,Russian,,2022
Maxton Hall,2024/05/09,,6.7,"[""Drama"", ""Romance"", ""Thriller""]",Running,Prime Video,"When Ruby unwillingly witnesses an explosive secret at Maxton Hall Private School, arrogant millionaire heir James Beaufort is forced to confront the quick-witted scholarship student, much to his chagrin: He is determined to silence Ruby. Their passionate exchange of blows surpr…",Prime Video,German,,2024
A Good Girl's Guide to Murder,2024/07/01,,7.3,"[""Crime"", ""Thriller""]",Running,BBC iPlayer,"Five years ago, schoolgirl Andie Bell was murdered by Sal Singh. Case closed. The police know he did it. Everyone in town knows he did it. But Pippa Fitz-Amobi - our insatiably smart, slightly square heroine - isn't so sure and she's determined to prove it. But if Sal Singh isn'…",BBC iPlayer,English,,2024
Fifteen-Love,2023/07/21,2023/07/21,6.1,"[""Drama"", ""Sports""]",Ended,Prime Video,Former tennis prodigy Justine Pearce makes an allegation against her former coach Glenn Lapthorn 5 years after an injury puts a stop to her career.,Prime Video,English,,2023
Joko Anwar's Nightmares and Daydreams,2024/06/14,2024/06/14,5.5,"[""Science-Fiction"", ""Thriller"", ""Supernatural""]",Ended,Netflix,Joko Anwar's Nightmares and Daydreams is a sci-fi thriller series about ordinary people encountering strange phenomena. The series has multiple storylines which intersect with each other and lead to a dramatic denouement.,Netflix,Indonesian,,2024
Cunk on Earth,2022/09/20,2024/12/30,7.7,"[""Comedy"", ""Travel"", ""History""]",Ended,BBC iPlayer,"In this deeply profound and important mockumentary series from Charlie Brooker, Philomena Cunk tells the entire story of Human Civilisation from prehistoric times to the present day, covering all the main bits of History, Science, Culture and Religion.",BBC iPlayer,English,,2022
Boy Swallows Universe,2024/01/11,2024/01/11,6.5,"[""Drama"", ""Crime"", ""Family""]",Ended,Netflix,A young boy growing up in the suburbs of 1980s Brisbane faces the harsh realities of life — and the looming dangers that threaten his family.,Netflix,English,,2024
Bloodhounds,2023/06/09,,7.6,"[""Drama"", ""Action"", ""Crime""]",To Be Determined,Netflix,Two young boxers band together with a benevolent moneylender to take down a ruthless loan shark who preys on the financially desperate.,Netflix,Korean,,2023
Reborn Rich,2022/11/18,2022/12/25,8.0,"[""Drama"", ""Fantasy"", ""Mystery""]",Ended,jTBC,"After ten years, a loyal employee is framed for embezzlement, then murdered by his employers, only to be reborn as their youngest son, with a yearn for revenge guiding his hostile takeover.",,Korean,,2022
UnPrisoned,2023/03/10,2024/07/17,6.3,"[""Drama"", ""Comedy""]",Ended,Hulu,Follows a therapist and single mom whose life is turned right-side-up when her dad gets out of prison and moves to her house to live with her and her teenage son.,Hulu,English,,2023
North Shore,2023/05/10,,6.9,"[""Drama"", ""Crime"", ""Mystery""]",To Be Determined,Network 10,"North Shore follows the clash of cultures when British and Australian detectives team to solve a complex murder mystery, and uncover a conspiracy with international political consequences.",,English,60,2023
Sago Mini Friends,2022/09/16,,7.0,"[""Children"", ""Music""]",To Be Determined,Apple TV,"This preschool animated series follows Harvey the floppy-eared dog and his best friends: Jinja the cat, Jack the rabbit, and Robin the bird. Along with a unique cast of residents as colorful as their own whimsical world, the four friends play, explore, imagine and celebrate dail…",Apple TV,English,,2022
Munich Games,2022/09/02,2022/10/02,5.5,"[""Crime"", ""Thriller"", ""Espionage""]",Ended,WOW,"50 years after the terrorist attack on the Olympic Games, a friendly soccer match between an Israeli and a German football club is planned, as a memorial service for the victims of the 1972 event. Police and secret services are on high alert to ensure the security of the event.…",WOW,German,,2022
A Thousand Blows,2025/02/21,,6.2,"[""Drama"", ""History""]",Running,Disney+,"Hezekiah and Alec, two friends from Jamaica, find themselves thrust into the criminal underbelly of Victorian London's East End. Here they meet Mary Carr, Queen of an all-female criminal gang known as the Forty Elephants, and run afoul of Sugar Goodson, criminal kingpin and noto…",Disney+,English,,2025
Les Lascars,1998/06/21,1998/08/22,5.6,"[""Comedy""]",Ended,Canal+,"Aged between fifteen and twenty-five, the lads live in urban areas. They occupy their time in different places (street, metro, stairs, apartment, shopping center, nightclub, etc.) and in different ways: flirting, parties, fights, discussions, break dancing, etc.",,French,2,1998
Фандорин. Азазель,2023/01/19,2023/02/23,5.8,"[""Adventure"", ""Science-Fiction"", ""Mystery""]",Ended,КиноПоиск,"The October Revolution hadn't happened, and the Bolsheviks had never risen to power. The year is 2023, and the rule over the Russian Empire is divided between tzar Nikolai III and a forward-thinking PM, Dmitry Orlov. Erast Fandorin, a 20-year-old police servant, has just been hi…",КиноПоиск,Russian,,2023
Once Again,2022/09/15,2022/10/06,6.8,"[""Drama"", ""Romance""]",Ended,Heavenly,"Shin Jae Woo is haunted by painful memories, yearning to change his destiny and that of Kang Ji Hoon. In 2007, their paths crossed, and Shin Jae Woo fell for Kang Ji Hoon deeply. However, fate tore them apart, and he's carried the guilt ever since. Fifteen years later, he finds…",Heavenly,Korean,,2022
Urban Legend,2022/10/28,,4.8,"[""Horror""]",To Be Determined,Travel Channel,"This nightmarish anthology series, under the creative guidance of master of horror Eli Roth, showcases classic urban legends as you've never seen them before. Based on widely shared ""true"" stories that happened to a friend of a friend … of a friend, each episode of Urban Legend…",,English,60,2022
Tyler Perry's Zatima,2022/09/22,,2.6,"[""Comedy""]",Running,BET+,"Zac and Fatima take a huge step to strengthen their bond, but new friends and past actions interfere with their blossoming relationship.",BET+,English,,2022
Outchef'd,2022/09/27,,5.3,"[""Food""]",Running,Food Network,Confident home cooks think they are arriving for an audition - but get the surprise of their lives when they find out they are actually heading into a head-to-head competition against a world-class chef. These home cooks excel in their own kitchen - but do they have what it take…,,English,30,2022
The Perfect Couple,2024/09/05,2024/09/05,6.4,"[""Drama"", ""Crime"", ""Mystery""]",Ended,Netflix,"Amelia Sacks is about to marry into one of the wealthiest families on Nantucket. Her disapproving future mother-in-law, famous novelist Greer Garrison Winbury, has spared no expense in planning what promises to be the premiere wedding of the season - until a body turns up on the…",Netflix,English,,2024
May It Please the Court,2022/09/21,2022/10/26,6.8,"[""Drama"", ""Mystery"", ""Legal""]",Ended,Disney+,"The story of No Chak-hee, a third-month public defender who has to defend a murderer who murdered his loved one, falling into the biggest dilemma of her life.",Disney+,Korean,,2022
Mayflies,2022/12/27,2022/12/27,7.8,"[""Drama""]",Ended,BBC iPlayer,"Everyone has a Tully Dawson - the friend who defines your life. In the summer of 1986, in a small Scottish town, Jimmy and Tully ignite a brilliant friendship based on music, films and the rebel spirit. With school over and the locked world of their fathers before them, they rus…",BBC iPlayer,English,,2022
Queen of Oz,2023/06/16,2023/06/16,7.3,"[""Comedy""]",Ended,BBC iPlayer,"Princess Georgiana is the black sheep of a fictional British Royal Family. A PR disaster, she's spent her spoilt, party-girl life plastered over the tabloids. On the back of her latest scandal her father, the King, makes the unprecedented move of abdicating his Australian throne…",BBC iPlayer,English,,2023
Forsvinningen – Lørenskog 31. oktober 2018,2022/09/14,2022/09/14,6.4,"[""Drama"", ""Crime""]",Ended,Netflix,"When a billionaire's wife vanishes, Norwegian police must deal with the frenzied press and deceitful informants to find the truth. Based on real events.",Netflix,Norwegian,,2022
Parasyte: The Grey,2024/04/05,2024/04/05,7.5,"[""Action"", ""Horror"", ""Science-Fiction""]",Ended,Netflix,"When unidentified parasites violently take over human hosts and gain power, humanity must rise to combat the growing threat.",Netflix,Korean,,2024
Sins of Our Mother,2022/09/14,2022/09/14,6.5,"[""Crime""]",Ended,Netflix,"Lori Vallow was known to friends and family as a devoted mother of three, a loving wife, and a woman of God. But over the past three years, something went very wrong: Now Lori is in jail, waiting to stand trial for conspiracy to commit murder and first-degree murder in connectio…",Netflix,English,,2022
Dork Hunters from Outer Space,2008/01/01,2008/01/01,3.3,"[""Children"", ""Science-Fiction""]",Ended,ITV1,Five kids from New Jersey fight against an evil alien species named the Dorks in order to retrieve some peculiar and extremely dangerous explosives called microgalaxies.,,English,22,2008
Tú no eres especial,2022/09/02,,6.5,"[""Drama"", ""Comedy"", ""Romance""]",To Be Determined,Netflix,Life in Amaia's new hometown starts to get a lot more interesting when a rumor spreads at school that she's inherited her grandmother's magical talents.,Netflix,Spanish,,2022
Bobby's Triple Threat,2022/09/27,,5.8,"[""Food""]",Running,Food Network,"In Bobby's Triple Threat one extraordinarily talented and eager chef is challenged to go against the trio of culinary titans handpicked by Bobby himself for a chance to take home $25,000. The stakes couldn't be higher, as Bobby celebrates and tests the most talented chefs in Ame…",,English,60,2022
The Decameron,2024/07/25,2024/07/25,4.9,"[""Comedy"", ""History""]",Ended,Netflix,"As the bubonic plague spreads through Italy, a group of nobles and servants retreats to a villa, where their lavish getaway quickly spirals into chaos.",Netflix,English,,2024
Aashiqana,2022/06/06,2023/09/09,5.8,"[""Crime"", ""Romance"", ""Thriller""]",Ended,JioHotstar,"A serial killer sparks the story of uptight Yashvardhan and feisty Chikki. Plagued by misunderstandings, how far do they have to go to nab the murderer? Uptight cop Yashvardhan and feisty Chikki's worlds collide because of a serial killer.",JioHotstar,Hindi,,2022
Tales from the Explorers Club,2022/08/31,,6.4,"[""Adventure"", ""Travel"", ""History""]",To Be Determined,Discovery,"Hosted by Josh Gates, Tales from the Explorers Club will take viewers inside Explorers Club New York headquarters to tell the stories from explorers who pushed the bounds of human possibility, venturing to Earth's highest peaks, deepest ocean trenches, the North and South poles,…",,English,60,2022
The Woman in the Wall,2023/08/27,2023/09/24,6.9,"[""Drama"", ""Thriller"", ""Mystery""]",Ended,BBC One,"Lorna Brady is a woman from the small, fictional town of Kilkinure, who wakes one morning to find a corpse in her house. Chillingly, Lorna has no idea who the dead woman is or if she herself might be responsible for the apparent murder…That's because Lorna has long suffered from…",,English,60,2023
Haus of Vicious,2022/08/17,,1.0,"[""Drama""]",Running,BET+,"From creator Jill Ramsey, the eight-episode first season follows Roman's character Chantel Vivian, a fashion designer whose success is overshadowed by her narcissistic husband, addiction, unresolved childhood traumas and dysfunctional personal life. With the assistance of her se…",BET+,English,60,2022
Tierra Incógnita,2022/09/08,,3.8,"[""Adventure"", ""Horror"", ""Mystery""]",Running,Disney+,"After his parents mysteriously disappeared eight years ago, young Eric Dalaras embarks on a search for the truth and enters a frightening world. He and his sister Uma grew up with their maternal grandparents. Eric decides to leave his homeland to return to the place of his child…",Disney+,Spanish,,2022
Housing Complex C,2022/10/01,,5.6,"[""Anime"", ""Horror""]",To Be Determined,AdultSwim.com,"Housing Complex C centers around Kimi, who lives in a small housing complex located in the sleepy seaside town of Kurosaki. But trouble seems to follow Kimi wherever she goes, and soon, horrific incidents begin to occur... is an ancient evil stalking the residents of Housing Com…",AdultSwim.com,English,,2022
Wild Isles,2023/03/12,2023/04/09,7.7,"[""Nature""]",Ended,BBC One,Britain and Ireland have some of the most diverse and beautiful landscapes on Earth. We have more ancient oak trees than the rest of Europe put together; sixty percent of the world's chalk streams flow in southern England; our remaining flower meadows are a vital refuge for bree…,Prime Video,English,60,2023
La Légende de Croc-Blanc,1992/11/16,1993/05/10,5.2,"[""Adventure"", ""Children""]",Ended,TF1,"In the wilderness of the far North, in a place called the Klondike, there lived an animal who became a legend. They call him White Fang. Part wolf and part husky, White Fang ran with the wind. Nothing could stop him for he was wild and free.Then thousands of people came seeking…",,French,,1992
On Patrol: First Shift,2022/08/12,,1.0,"[""Crime""]",Running,REELZ,"On Patrol: Live's Dan Abrams, Sean ""Sticks"" Larkin, and Curtis Wilson provide a sneak peek at tonight's On Patrol: Live and share favorite moments from previous programs.",,English,60,2022
Ai Long Nhai,2022/09/26,2023/03/25,7.0,"[""Drama"", ""Romance""]",Ended,Channel 3,"Ai studied abroad and was ordered by his father to continue his studies in Thailand and meets Nai, with whom he falls in love at first sight.",,Thai,60,2022
Far North,2023/08/13,2023/09/03,6.5,"[""Drama"", ""Comedy"", ""Crime""]",Ended,ThreeNow,"Far North tells the (mostly) true story of how the most comically inept gang to ever join forces got half a billion dollars' worth of meth to New Zealand shores - and nearly to market. And they would have got away with it too, if it wasn't for a pesky 70-year-old Māori diesel me…",ThreeNow,English,,2023
Black Snow,2023/01/01,,7.2,"[""Drama"", ""Crime"", ""Mystery""]",To Be Determined,Stan,"In 1994, seventeen-year-old Isabel Baker was murdered. The crime shocked the small town of Ashford and devastated Isabel's Australian South Sea Islander community. The case was never solved, the killer never found. But in 2019, the opening of a time capsule unearths a secret tha…",Stan,English,,2023
Clean Sweep,2023/05/14,2023/05/14,6.4,"[""Drama"", ""Crime"", ""Thriller""]",Ended,RTÉ Player,"Inspired by true events, Clean Sweep follows Shelly Mohan, a housewife, mother of three, married to a Garda detective, who kills her former partner in crime when he threatens to expose her dark past. With her unsuspecting husband hunting for the killer, Shelly must cope with pre…",RTÉ Player,English,,2023
Sanctuary: A Witch's Tale,2024/01/04,,5.6,"[""Drama"", ""Mystery"", ""Supernatural""]",Running,Sundance Now,"Based on the novel by V.V. James, Sanctuary: A Witch's Tale is set in a contemporary world where witchcraft is real. It takes place in the idyllic English town of Sanctuary, where for hundreds of years witches have lived peacefully, as valued members of society. Until now... At…",Sundance Now,English,,2024
