Title,First air date,End date,Rating,Genres,Status,Network,Summary,Web Channel,Language,Runtime,Premiered Year
Totally Completely Fine,2023/04/20,,7.4,"[""Comedy""]",To Be Determined,Stan,"Totally Completely Fine follows 20-something Vivian Cunningham, whose life is a mess. Last week she accidentally burnt down her brother's vegan food truck with a bacon-flavored vape and this week she's inherited her grandfather's coastal clifftop shack and is tasked with helping…",Stan,English,,2023
St. Denis Medical,2024/11/12,,4.1,"[""Comedy"", ""Medical""]",Running,NBC,"St. Denis Medical is a mockumentary about an underfunded, understaffed Oregon hospital where the dedicated doctors and nurses try their best to treat patients while maintaining their own sanity.",,English,30,2024
Wicked City,2022/12/01,,2.3,"[""Drama"", ""Supernatural""]",To Be Determined,ALLBLK,"Wicked City follows five urban witches who push their supernatural powers to new heights after uncovering dark secrets and accidentally entering the world of the forbidden. While living their best life in Atlanta, four young, chic, modern-day witches, Jordan Davis, Mona De La Cr…",ALLBLK,English,,2022
Narco-Saints,2022/09/09,2022/09/09,6.6,"[""Crime"", ""Thriller""]",Ended,Netflix,Narco-Saints is a series about a man involved in a National Intelligence Service (NIS) secret operation after being framed by a drug lord who controls South America Suriname under his thumb.,Netflix,Korean,,2022
Bali 2002,2022/09/24,2022/09/24,7.0,"[""Drama""]",Ended,Stan,"Based on the 2002 terrorist attacks on Bali's tourist hotspots, Bali 2002 is an inspiring drama that explores how everyday heroes from Bali, Australia and beyond defied the odds to bring order from chaos and hope from despair.",Stan,English,,2022
Tierra de Mujeres,2024/06/26,,5.5,"[""Drama"", ""Comedy""]",To Be Determined,Apple TV,A New York socialite is forced to flee to a charming Spanish wine town with her mother and daughter. She finds herself navigating small-town quirks while also confronting her deepest family secrets—and a pair of bumbling hit men.,Apple TV,Spanish,,2024
Gordon Ramsay: Uncharted Showdown,2022/07/25,,6.6,"[""Food"", ""Travel""]",Running,National Geographic,Gordon faces off against two former proteges in the U.K. and his daughter in Costa Rica to win the locals' favor in three epic cook offs.,,English,,2022
Жизнь по вызову,2022/08/25,,7.6,"[""Drama"", ""Thriller""]",Running,KION,"Alexander Schmidt is the owner of an elite escort agency. He is called Magic — he and his team are able to fulfill almost any desire. Among the clients are respected people: businessmen, politicians, security officials, public figures. The team — represented by a former bandit n…",KION,Russian,,2022
Chainsaw Man,2022/10/11,,7.8,"[""Anime"", ""Horror"", ""Supernatural""]",Running,TV Tokyo,"Denji has a simple dream—to live a happy and peaceful life, spending time with a girl he likes. This is a far cry from reality, however, as Denji is forced by the yakuza into killing devils in order to pay off his crushing debts. Using his pet devil Pochita as a weapon, he is re…",,Japanese,24,2022
The Franchise,2024/10/06,2024/11/24,4.9,"[""Comedy""]",Ended,HBO,"The Franchise follows the crew of an unloved franchise movie fighting for their place in a savage and unruly cinematic universe. The comedy series shines a light on the secret chaos inside the world of superhero moviemaking, to ask the question — how exactly does the cinematic s…",,English,30,2024
Archie: the man who became Cary Grant,2023/11/23,2023/11/23,7.6,"[""Drama""]",Ended,ITVX,"Archie: the man who became Cary Grant will tell the story of Cary Grant's life, from his humble beginnings as Archibald Alexander Leach in Bristol, UK, to the leading man he became in later life.",ITVX,English,,2023
I Just Killed My Dad,2022/08/09,2022/08/09,7.3,"[""Crime"", ""Legal""]",Ended,Netflix,Anthony Templet shot his father and never denied it. But why he did is a complex question with profound implications that go far beyond one family.,Netflix,English,,2022
Deepa & Anoop,2022/08/15,,5.3,"[""Children""]",To Be Determined,Netflix,"Joined by her color-changing pet elephant, a joyful little girl creates music, merriment and mischief at her Indian family's Mango Manor hotel.",Netflix,English,,2022
Hysteria!,2024/10/18,2024/10/18,5.0,"[""Thriller"", ""Supernatural""]",Ended,Peacock,"When a beloved varsity quarterback disappears during the ""Satanic Panic"" of the late 1980s, a struggling high school heavy metal band of outcasts realize they can capitalize on the town's sudden interest in the occult by building a reputation as a Satanic metal band, until a biz…",Peacock,English,,2024
Ride,2023/03/26,2023/05/28,6.9,"[""Drama""]",Ended,Hallmark Channel,"Ride follows the lives of the McMurrays, part of a rodeo dynasty going back a generation, as they struggle to keep their beloved ranch afloat. After a tragic loss, each character embarks on an empowering journey of transformation and self- discovery while also uncovering a twist…",,English,60,2023
The Other Black Girl,2023/09/13,2023/09/13,5.7,"[""Drama"", ""Comedy"", ""Mystery""]",Ended,Hulu,"The series tells the story of Nella, an editorial assistant who is tired of being the only black girl at her company, so she's excited when Hazel is hired. But as Hazel's star begins to rise, Nella spirals out and discovers something sinister is going on at the company.",Hulu,English,,2023
Outlander: Blood of My Blood,2025/08/08,,7.3,"[""Drama"", ""Adventure"", ""Romance""]",Running,STARZ,"Outlander: Blood of My Blood explores the lives and relationship of Claire's parents, Julia Moriston and Henry Beauchamp, and Jamie's parents, Ellen MacKenzie and Brian Fraser. The series centers on these two parallel love stories set in two different time periods, with Jamie's…",,English,60,2025
The Veil,2024/04/30,2024/05/28,7.0,"[""Drama"", ""Thriller"", ""Espionage""]",Ended,Hulu,"The Veil is a thriller that explores the surprising and fraught relationship between two women who play a deadly game of truth and lies on the road from Istanbul to Paris and London. One woman has a secret, the other a mission to reveal it before thousands of lives are lost. In…",Hulu,English,,2024
Past-Senger,2023/03/08,2023/05/24,7.1,"[""Drama"", ""Family"", ""Romance""]",Ended,AIS Play,"Kiew, a handsome and troublesome teen in the nineties, enjoys pranking people and aspires to study architecture. However, his life takes an unexpected turn when he is transported 25 years into the future. It's in 2022 where he meets Bamee, an introverted and isolated student who…",AIS Play,Thai,,2023
Alone: The Skills Challenge,2022/08/04,2023/06/10,7.1,"[""Adventure"", ""Nature""]",Ended,History,"Alone: The Skills Challenge pits 3 former Alone participants head-to-head to complete incredible bushcraft builds using only basic tools and the natural resources around them. Their goal: to prove who has the ingenuity, experience and wilderness skills to craft the most unbeliev…",,English,30,2022
Big Tree City,2022/08/01,,5.3,"[""Comedy"", ""Action"", ""Children""]",To Be Determined,Netflix,A team of animal heroes with special skills and speedy vehicles work together to keep Big Tree City safe and solve the town's trickiest problems.,Netflix,English,,2022
Deadliest Catch: The Viking Returns,2022/09/13,,7.8,"[""Action"", ""Adventure"", ""Nature""]",To Be Determined,Discovery,"When the Alaskan Red King Crab fishery shuts down for the first time in 25 years, Bering Sea veteran Captain Sig Hansen is forced to look for opportunities elsewhere. Deciding to risk it all, he sets his sights on a promising new fishing ground where King Crab is an invasive spe…",,English,60,2022
Cannes Confidential,2023/06/26,,6.6,"[""Drama"", ""Crime"", ""Romance""]",To Be Determined,Acorn TV,"Gutsy French detective Camille Delmasse loves her job and her family fiercely. After her father, the former police chief, is accused of corruption, Camille is determined to clear his name. She coerces help from suave con man Harry King, who's in Cannes on a secret quest of his o…",Acorn TV,English,,2023
The Regime,2024/03/03,2024/04/07,5.1,"[""Drama"", ""Comedy""]",Ended,HBO,"The Regime tells the story of life within the walls of a modern authoritarian regime as it unravels.After not leaving the palace for quite some time, Chancellor Elena Vernham becomes increasingly paranoid and unstable and turns to a volatile soldier, Herbert Zubak, as an unlikel…",,English,60,2024
Animal Control,2023/02/16,,7.1,"[""Comedy""]",Running,FOX,"Animal Control is a workplace comedy following a group of Animal Control workers whose lives are complicated by the fact that animals are simple, but humans are not.",,English,30,2023
Those About to Die,2024/07/18,,6.8,"[""Drama"", ""Action"", ""History""]",To Be Determined,Peacock,"Those About to Die is a large-scale drama set within the spectacular, complex, and corrupt world of gladiatorial sports in Ancient Rome. The series introduces an ensemble of characters from all corners of the Roman Empire who collide at the explosive intersection of sports, poli…",Peacock,English,,2024
Trainwreck: Woodstock '99,2022/08/03,2022/08/03,7.8,"[""Music""]",Ended,Netflix,"Woodstock 1969 promised peace and music, but its '99 revival delivered days of rage, riots and real harm. Why did it go so horribly wrong?",Netflix,English,,2022
Daily Dose of Sunshine,2023/11/03,2023/11/03,7.0,"[""Drama""]",Ended,Netflix,Heartwarming drama about a caring young nurse navigates the complex world of mental health and the diverse stories of her patients.,Netflix,Korean,,2023
Kage no Jitsuryokusha ni Naritakute!,2022/10/05,,7.2,"[""Action"", ""Anime"", ""Fantasy""]",Running,AT-X,"Shadowbrokers are those who go unnoticed, posing as unremarkable people, when in truth, they control everything from behind the scenes. Sid wants to be someone just like that more than anything, and something as insignificant as boring reality isn't going to get in his way! He t…",,Japanese,30,2022
Daredevil: Born Again,2025/03/04,,7.5,"[""Drama"", ""Action"", ""Science-Fiction""]",Running,Disney+,Matt Murdock finds himself on a collision course with Wilson Fisk when their past identities begin to emerge.,Disney+,English,,2025
Copenhagen Cowboy,2023/01/05,,6.1,"[""Drama"", ""Crime"", ""Thriller""]",To Be Determined,Netflix,"Copenhagen Cowboy is a thrill-inducing, neon-drenched noir series which follows enigmatic young heroine, Miu. After a lifetime of servitude and on the verge of a new beginning, she traverses the ominous landscape of Copenhagen's criminal netherworld. Searching for justice and en…",Netflix,Danish,,2023
The Doll Factory,2023/11/27,2023/12/01,6.0,"[""Thriller""]",Ended,Paramount+,"Set in London in 1850, The Doll Factory tells the story of Iris, who paints dolls for a living alongside her twin sister, Rose, and dreams of becoming an artist and by night secretly paints herself naked. Silas is a taxidermist who owns a shop filled with his creations. He dream…",Paramount+,English,,2023
About Youth,2022/08/29,2022/09/19,7.5,"[""Drama"", ""Romance""]",Ended,Bilibili,"Ye Guang is an elite high school student and a popular campus idol, while Xu Qi Zhang is an exemplary guitarist who normally has a weak sense of existence but completely transforms himself when on stage. The two boys have completely different backgrounds and values but when they…",Bilibili,Chinese,,2022
Ludik,2022/08/26,,5.0,"[""Drama"", ""Crime""]",To Be Determined,Netflix,"The series revolves around Ludik, who appears to be a salt of the earth oke, styling himself as a wholesome family man running a successful furniture business. However, behind the veneer of respectability, Ludik is steeped in the underworld that sees him crossing paths with mobs…",Netflix,Afrikaans,,2022
90 Day Fiancé UK,2022/07/24,,5.6,"[""Romance""]",To Be Determined,discovery+,"Follow eight loved-up Brits and their long-distance lovers for 90 days to see if they commit or call the whole thing off! For these real life couples the stakes could not be higher - so much could go wrong, and so much could go right.",discovery+,English,,2022
Tracker,2024/02/11,,7.4,"[""Drama""]",Running,CBS,"Tracker features lone-wolf survivalist Colter Shaw, who roams the country as a ""reward seeker,"" using his expert tracking skills to help private citizens and law enforcement to solve all manner of mysteries while contending with his own fractured family.",,English,60,2024
Transformers: EarthSpark,2022/11/11,,4.8,"[""Action"", ""Adventure"", ""Science-Fiction""]",To Be Determined,Paramount+,"The civil war between the Autobots and the Decepticons has relocated to a planet far from Cybertron, Earth. There, a new breed of Transformers emerges, when a multicultural family adopts them, ensuring their survival and the ties they make to their lineage.",Paramount+,English,,2022
Zeytin Ağacı,2022/07/28,,6.0,"[""Drama"", ""Romance""]",To Be Determined,Netflix,"Three friends arrive in a seaside town, where they connect with their spiritual selves and suddenly face unresolved trauma from their families' pasts. They will make peace with their past in order to make life changing decisions and eventually to create their own another-selves.",Netflix,Turkish,,2022
Doctor Cha Jung Sook,2023/04/15,,6.5,"[""Medical""]",Running,jTBC,"It tells the story of a medical graduate turned housewife but decided to return to the medical field, and a doctor husband who maintains a perfect dual life. He is great at his job and he is also great at cheating on his wife.",TVING,Korean,,2023
Барабашка,2022/09/19,2022/09/22,6.7,"[""Comedy""]",Ended,Premier,"A comedy series with Anton Filipenko and Olga Dibtseva about a brownie who forces the owner of the apartment to unwittingly solve the accumulated problems. Artyom is quarantined at home alone and notices something strange: things are out of place, food disappears right from unde…",Premier,Russian,25,2022
Капельник,2022/09/15,2022/09/22,7.8,"[""Drama"", ""Comedy""]",Ended,Premier,"Vanya is an anesthesiologist-resuscitator in an ordinary Moscow hospital, in his spare time he works as a ""dropper"" - illegally removes post-drug syndrome from stellar drug addicts and alcoholics.",Premier,Russian,,2022
Закрыть гештальт,2022/08/11,,6.9,"[""Comedy"", ""Fantasy""]",Running,КиноПоиск,"Miraculously surviving after falling from the 20th floor, the manager of the car dealership Fedor Yartsev acquires an unusual gift: now he sees ghosts. A vindictive mother—in-law and a school physical education teacher, a bandit from the nineties and an elderly intellectual - wh…",КиноПоиск,Russian,,2022
Love in Contract,2022/09/21,2022/11/10,7.0,"[""Drama"", ""Romance""]",Ended,tvN,A drama about single life helpers who become wives to single men who need wives to attend meetings.Tells the story of a helper service that provides wives to single people needing partners to take to gatherings for married couples and school reunions. The story portrays Choi San…,TVING,Korean,67,2022
The First Responders,2022/11/12,2023/09/09,7.2,"[""Drama""]",Ended,SBS,"A joint response field log between the police who catch criminals and firefighters who catch fires. The police station and the fire station jointly respond to fierce scenes between crime, disasters and emergencies.",wavve,Korean,,2022
The Law Cafe,2022/09/05,2022/10/25,5.0,"[""Romance"", ""Legal""]",Ended,KBS2,"A work that deals with the story of a former prosecutor-turned-building owner who used to be called a monstrous genius and a former Miss Korea turned lawyer, surrounding the law office and 'law café'.Adapted from the web novel ""Love According to Law"" (법대로 사랑하라) written by No Seu…",,Korean,70,2022
Little Women,2022/09/03,2022/10/09,7.9,"[""Drama"", ""Family""]",Ended,tvN,Little Women is a work that depicts the story of three sisters who have good friendship.,,Korean,70,2022
If You Wish Upon Me,2022/08/10,2022/09/29,7.8,"[""Drama""]",Ended,KBS2,The story of patients and the caregivers of a hospice department. It is the story of people who dream of 'well-dying'.,,Korean,60,2022
Dreamland,2023/04/06,,7.4,"[""Drama"", ""Comedy""]",To Be Determined,Now,"Dreamland is about secrets, lies, loves and aspirations within a family of four sisters. Set in the sun-drenched British seaside town of Margate, it is a dark comedic exploration of multi-generational female relationships, and their (somewhat dysfunctional) family dynamics.Eldes…",Now,English,,2023
Takara-kun & Amagi-kun,2022/08/18,2022/10/13,6.6,"[""Drama"", ""Romance""]",Ended,MBS,"Takara belongs to the most prominent group in his class and is highly popular with the others, while Amagi is more quiet but is still bright, energetic and generally well-liked. Although they are classmates, the boys have no direct interaction with each other due to the differen…",,Japanese,30,2022
His Man,2022/07/15,,6.5,"[""Romance""]",Running,wavve,"As South Korea's very first gay dating reality series, His Man brings together a group of eight hot, sexy, free and single gay men to a shared house where they are to live, interact and open up to each other in their quest for ""true love"".",wavve,Korean,,2022
Riptide,2022/12/27,2022/12/30,6.4,"[""Thriller"", ""Mystery""]",Ended,5,"Riptide follows Alison, whose life is plunged into despair when her new Australian husband vanishes after a morning surf. It quickly becomes obvious there is more to the story than meets the eye as she sets out to investigate his disappearance.",,English,60,2022
