Title,First air date,End date,Rating,Genres,Status,Network,Summary,Web Channel,Language,Runtime,Premiered Year
Pop Paper City,2022/11/12,,6.8,"[""Children""]",To Be Determined,5,Pop Paper City is the capital of a captivating paper world where paper friends live.,,English,,2022
Happy Ending Romance,2022/11/24,2022/12/15,7.0,"[""Drama"", ""Romance""]",Ended,Heavenly,"Cha Jung Woo might have had a bright future as a writer, had he not chosen to speak up against the corruption he witnessed among his seniors. Unfortunately, being unable to remain silent when faced with such unscrupulous behavior, Jung Woo chose to speak up, essentially ending h…",Heavenly,Korean,,2022
Ameiro Paradox,2022/12/15,2023/02/09,7.5,"[""Drama"", ""Romance""]",Ended,MBS,"A change in the stakeout team throws Onoe, reporter for a weekly magazine, together with his contemporary, Kaburagi, a photographer. Onoe secretly considers Kaburagi his rival, and Kaburagi's haphazard way of doing things goes against Onoe's strong sense of ethics--there's nothi…",,Japanese,30,2022
Happy the Hoglet,2022/11/14,,7.3,"[""Children""]",To Be Determined,itv QUiZ,"An animated series for preschool children. Happy is prickly, smelly and has fleas - life with his best friends has its ups and downs, but it is always full of laughs and adventure.",,English,10,2022
Life on Our Planet,2023/10/25,,8.0,"[""Nature""]",To Be Determined,Netflix,"Life's extraordinary journey to conquer, adapt and survive on Earth across billions of years comes alive in this groundbreaking nature docuseries.",Netflix,English,,2023
The Spencer Sisters,2023/01/29,2023/04/21,7.0,"[""Drama"", ""Comedy"", ""Crime""]",Ended,CTV,"In The Spencer Sisters, after a string of bad luck, Toronto police officer Darby Spencer quits her job and is forced to return home to her estranged mother, internationally renowned mystery novelist Victoria Spencer. After the duo are thrust into solving a crime together, Darby…",,English,60,2023
Shelved,2023/03/06,,3.6,"[""Comedy""]",Running,CTV,Follows the employees and patrons of Jameson Public Library as they go about their lives in this unassuming and extraordinary place.,,English,30,2023
The Bermuda Triangle: Into Cursed Waters,2022/11/22,,7.6,"[""Mystery"", ""History"", ""Supernatural""]",To Be Determined,History,"The Bermuda Triangle is the most notorious stretch of ocean in history, evoking fear and endless fascination. Bounded by Florida, Bermuda and Puerto Rico, these waters have swallowed countless ships and planes and their crews—some vanishing without a trace.",,English,62,2022
Forever,2025/05/08,,6.0,"[""Drama"", ""Romance""]",Running,Netflix,"Reunited as teens, two childhood friends fall deeply in love, experiencing the joy and heartache of a first romance that will change their lives forever.",Netflix,English,,2025
Joan,2024/09/29,2024/09/29,5.6,"[""Drama"", ""Crime""]",Ended,ITVX,"Joan is inspired by the true story of notorious jewel thief, Joan Hannington.Joan, a fiery and uncompromising woman in her twenties who is deeply scarred and vulnerable, is a devoted mother to her six-year-old daughter Kelly but is trapped in a disastrous marriage with a violent…",ITVX,English,,2024
Universal Basic Guys,2024/09/08,,4.9,"[""Comedy""]",Running,FOX,"In Universal Basic Guys brothers Mark and Hank Hoagies suddenly find themselves with no jobs when the Glantontown Hot Dog factory switches over to automation. Lucky for them, the town started a radical Universal Basic Income pilot program, giving all residents of Glantontown $3,…",,English,30,2024
Three-Body,2023/01/15,,7.5,"[""Drama"", ""Science-Fiction""]",Running,Tencent QQ,"Adapted from the novel ""The Three-Body Problem"" (三体) by Liu Ci Xin (刘慈欣).A nanomaterials expert sees a mysterious countdown superimposed in his field of vision and finds himself under military investigation. To unravel the mystery, he enters the VR game ""Three-Body"" developed by…",Tencent QQ,Chinese,,2023
Our Universe,2022/11/22,2022/11/22,6.0,"[""Nature"", ""History""]",Ended,Netflix,"Witness the remarkable story of our universe over billions of years and its inextricable link to life on Earth in this sweeping documentary series. Narrated by Academy Award-winner Morgan Freeman, comes an epic tale 13.8 billion years in the making. Blending stunning wildlife fo…",Netflix,English,,2022
7 vs. Wild,2021/11/06,,8.0,"[""Adventure"", ""Nature""]",Running,Amazon Freevee,"Abandoned in the wilderness, seven candidates fight for seven days to survive. Everyone has to make do with seven pre-selected objects and their clothes. Whoever is still left after seven days and has collected the most points in the daily challenges is the winner. No camera tea…",Amazon Freevee,German,,2021
The Gentlemen,2024/03/07,,7.7,"[""Comedy"", ""Action"", ""Crime""]",Running,Netflix,"When aristocratic Eddie inherits the family estate, he discovers that it's home to an enormous weed empire — and its proprietors aren't going anywhere.",Netflix,English,,2024
The Day of the Jackal,2024/11/07,,7.9,"[""Thriller""]",Running,Now,"The Day of the Jackal follows an unrivaled and highly elusive lone assassin, the Jackal, who makes his living carrying out hits for the highest fee. But following his latest kill, he meets his match in a tenacious British intelligence officer who starts to track down the Jackal…",Now,English,,2024
The Prank Panel,2023/05/24,,6.3,"[""Comedy""]",To Be Determined,ABC,"The Prank Panel lets everyday people pitch pranks targeting family members, friends and co-workers to a panel of the world's greatest pranksters. Johnny Knoxville, Eric Andre and Gabourey Sidibe form the all-star panel of ""pranxperts,"" taking viewers behind the scenes as they he…",,English,60,2023
Ancient Apocalypse,2022/11/11,,7.1,"[""History""]",To Be Determined,Netflix,What if everything we know about prehistoric humans is wrong? Journalist Graham Hancock visits archaeological sites around the world to uncover whether a civilization far more advanced than we ever believed possible existed thousands of years ago.,Netflix,English,,2022
Sausage Party: Foodtopia,2024/07/11,,6.8,"[""Comedy""]",To Be Determined,Prime Video,"After killing off all of humanity, Food attempts to create their own utopia.",Prime Video,English,,2024
Colin From Accounts,2022/12/01,,7.4,"[""Comedy"", ""Romance""]",Running,Binge,"Centred on Ashley and Gordon, two single(ish), complex humans who are brought together by a car accident and an injured dog, Colin From Accounts is about flawed, funny people choosing each other and being brave enough to show their true self, scars and all, as they navigate life…",Binge,English,,2022
Circuit Breakers,2022/11/11,,3.6,"[""Family"", ""Science-Fiction"", ""Mystery""]",To Be Determined,Apple TV,"Circuit Breakers is a half-hour thought-provoking futuristic anthology series about middle-schoolers in the near future that uses science fiction as a backdrop to tell universal stories about growing up. But not everything is as it seems, and their curiosity leads to chaos. Each…",Apple TV,English,,2022
Black Rabbit,2025/09/18,2025/09/18,6.5,"[""Drama"", ""Thriller""]",Ended,Netflix,"Set against the backdrop of New York City's high-pressure nightlife scene, Black Rabbit centers on two brothers who are pushed to the brink by their duty to family and their pursuit of success. Jake Friedken is the charismatic owner of Black Rabbit, a restaurant and VIP lounge,…",Netflix,English,,2025
Cross,2024/11/14,,6.9,"[""Crime"", ""Thriller"", ""Mystery""]",Running,Prime Video,"Based on NY Times Bestselling author James Patterson's #1 hero, Cross is a crime thriller that follows the investigations of brilliant forensic psychologist and DC Metro Detective Alex Cross. Together with his best friend and partner Detective John Sampson, Cross delves into the…",Prime Video,English,,2024
The Good Ship Murder,2023/10/13,,5.3,"[""Drama"", ""Crime"", ""Mystery""]",Running,5,"The Good Ship Murder is set aboard a luxury cruise liner touring everyone's favorite Mediterranean holiday hotspots bubbling with intrigue, rivalries, glamour, money and class divides – but its new cabaret singer, ex detective Jack Grayling, soon discovers there are also more si…",,English,60,2023
"Pepsi, Where's My Jet?",2022/11/17,2022/11/17,6.5,"[""History"", ""Legal""]",Ended,Netflix,"The year was 1996, and the cola wars were raging. Despite Pepsi's celeb-soaked advertisements, Coke still held the bigger market share, so the second-place brand decided to roll out their biggest campaign ever: Called ""Pepsi Stuff,"" it featured a soon-to-be infamous commercial i…",Netflix,English,,2022
The Bequeathed,2024/01/19,2024/01/19,5.2,"[""Crime"", ""Mystery""]",Ended,Netflix,"After the death of an unknown uncle, a woman inherits a burial ground and finds herself in the center of a string of murders and dark secrets.",Netflix,Korean,,2024
Fat Dog Mendoza,1998/01/01,2001/01/01,7.5,"[""Comedy"", ""Children""]",Ended,Cartoon Network,The very bizarre misadventures of a kid who aspires to be a superhero and his overweight dog companion.,,English,30,1998
I Feel You Linger in the Air,2023/08/18,2023/12/17,6.7,"[""Drama"", ""Romance"", ""History""]",Ended,One31,"I Feel You Linger In The Air is the story of Jom, a young architect who must come to control the design and renovation of an old house in Chiang Mai. However, during this project, Jom starts to have strange and frequent dreams about himself and a mysterious man from the past. At…",,Thai,60,2023
Bones of Crows,2023/09/20,2023/10/18,7.2,"[""Drama""]",Ended,CBC,"Bones of Crows is told through the eyes of Cree Matriarch, Aline Spears, as she survives Canada's residential school system to continue her family's generational fight in the face of systemic starvation, racism, and sexual abuse. The series is an expanded story from the feature…",,English,60,2023
Roots & Fruits,2022/10/24,,4.3,"[""Comedy"", ""Food"", ""Music""]",To Be Determined,BBC iPlayer,"The ultimate five (minutes) a day, starring fruit and veg performing and revealing fascinating facts about themselves in the most nutritious variety show around.",BBC iPlayer,English,,2022
Supertato,2022/10/17,,4.5,"[""Comedy"", ""Adventure"", ""Science-Fiction""]",Running,BBC iPlayer,"Follow the adventures of Supertato, the world's first potato superhero as he tackles the mischievous Evil Pea, in the supermarket aisles.",BBC iPlayer,English,,2022
GAP,2022/11/19,2023/02/11,7.8,"[""Comedy"", ""Romance""]",Ended,Channel 3,"Mon, a newly graduated student from university, starts working as an intern in a big company because she admires Sam, the super rich chairwoman since young age. However, when Mon met Sam again, her image of her completely crashed, since she was not like the media shows her.",YouTube,Thai,60,2022
Under the Bridge,2024/04/17,2024/05/29,7.6,"[""Drama"", ""Crime""]",Ended,Hulu,Limited series based on Rebecca Godfrey's book about the 1997 true story of a fourteen-year-old who went to join friends at a party and never returned home14-year-old Reena Virk joined friends at a party and never returned home. Through the eyes of Godfrey and a local police off…,Hulu,English,,2024
Solo Leveling,2024/01/06,,8.3,"[""Action"", ""Anime"", ""Fantasy""]",Running,Tokyo MX,"Ten years ago, ""the Gate"" appeared and connected the real world with the realm of magic and monsters. To combat these vile beasts, ordinary people received superhuman powers and became known as ""Hunters."" Twenty-year-old Sung Jin-Woo is one such Hunter, but he is known as the ""W…",,Japanese,30,2024
Иные,2024/01/25,,5.8,"[""Adventure"", ""Fantasy""]",To Be Determined,КиноПоиск,"Alternative 40s, Leningrad. Saving her brother, a fragile girl throws away a truck and a tram with the help of a supernatural force that she cannot control. They call themselves ""Others"" because they were born with a special gift. How to use force is up to everyone to decide for…",КиноПоиск,Russian,,2024
Why You… Y Me?,2022/10/19,2022/12/19,7.8,"[""Comedy"", ""Music"", ""Romance""]",Ended,YouTube,"It tells a story about BL's fandom through Gap, an ordinary boy that never has any experience and the female lead who is an active member of the fandom. The series is about the music band.",YouTube,Thai,,2022
Interior Chinatown,2024/11/19,,6.0,"[""Drama"", ""Action"", ""Crime""]",To Be Determined,Hulu,"Willis Wu is a background actor in a procedural cop show called Black &amp; White. Relegated to the background, Willis goes through the motions of his on-screen job, waiting tables and dreaming about a whole world beyond Chinatown. When he inadvertently becomes a witness to a cr…",Hulu,English,,2024
Король и Шут,2023/03/02,2023/08/07,6.0,"[""Drama"", ""Music""]",Ended,КиноПоиск,"The story of one of the most famous Russian punk bands ""Korol i Shut"" and its deceased frontman Mikhail ""Gorshok"" Gorshenev. The project will tell about the formation of the team, the ups and downs on its path to success, and the difficult relationships of the group members.",КиноПоиск,Russian,,2023
Внутри убийцы,2024/02/22,2024/03/21,7.0,"[""Thriller"", ""Mystery""]",Ended,КиноПоиск,"Profiler Zoya Volgina and special officer of the Investigative Committee Timofey Volokh are trying to identify the St. Petersburg strangler, who not only kills young women, but turns every crime scene into a ritual art object. The maniac embalms the bodies and leaves them in the…",КиноПоиск,Russian,,2024
Сны,2022/11/03,2022/11/24,7.5,"[""Science-Fiction"", ""Mystery""]",Ended,Premier,"A mystical detective with Pavel Priluchny and Lisa Moryak about a girl with a frightening gift - in her dreams she sees how people die. Zhenya helps solve crimes thanks to her incredible ability: she has visionary dreams in places where someone has died. Captain Makarov, who att…",Premier,Russian,30,2022
Gudetama: An Eggcellent Adventure,2022/12/13,2022/12/13,7.4,"[""Anime""]",Ended,Netflix,"A lethargic, empathetic road movie about finding one's parents — for everyone who just wants to laze about!Having resigned itself to the fact that it will just end up on someone's plate, Gudetama just wants to be lazy all the time. But, swept up by the go-getting, overbearing ch…",Netflix,Japanese,,2022
Cause of Death,2022/10/19,,8.0,"[""Medical""]",Running,5,"Series following the work of senior coroner for Lancashire and Darwen Dr James Adeley, who runs a team that works from the moment a body arrives in the mortuary through to the inquest, when the cause of death is determined.",,English,60,2022
El Encargado,2022/10/26,,7.6,"[""Comedy""]",Running,Disney+,"Eliseo is the superintendent of an upscale building. On the surface, Eliseo is cordial and docile in his role, but underneath Eliseo believes himself the omnipotent figure of the community — meddling in the affairs of residents and pulling strings as he sees fit. Eliseo's only c…",Disney+,Spanish,,2022
America's Got Talent: All-Stars,2023/01/02,2023/02/27,6.1,"[""Music""]",Ended,NBC,"America's Got Talent: All-Stars will feature winners, finalists, fan favorites, and viral sensations from previous seasons of the mothership series and Got Talent franchises around the world. The competitors will return to the stage to compete for the All-Star title.",,English,120,2023
Choco Milk Shake,2022/10/25,2022/12/20,7.2,"[""Drama"", ""Comedy"", ""Romance""]",Ended,YouTube,"Two strange men just barge in through the doors one day. They say that they are 'Choco', Jungwoo's childhood pet dog and 'Milk', his childhood cat. Can Jungwoo trust these weird and handsome men? A grand operation to find my love with my pet who came back crossing the rainbow br…",YouTube,Korean,,2022
Taskmaster,2023/02/02,,6.3,"[""Comedy""]",Running,Network 10,"Tom Gleeson stars as the Taskmaster, with Tom Cashman his devoted assistant. Each week the two Toms set five comedians a range of ridiculous tasks designed to bamboozle brains and put funny bones to the test.Who'll master the tasks? The cleverest clogs will score the most points…",,English,70,2023
13 клиническая,2022/12/22,2022/12/22,7.3,"[""Drama"", ""Mystery"", ""Medical""]",Ended,Иви,"Kirill, a talented surgeon with a terminal illness, gets a job at a hospital where patients are saved from supernatural forces. To survive, he will have to show his best side and prove to the management that the clinic needs him.",Иви,Russian,,2022
Jim Knopf,1999/08/26,2000/09/30,5.3,"[""Children""]",Ended,KiKa,,,German,25,1999
Watson,2025/01/26,,5.8,"[""Drama"", ""Mystery"", ""Medical""]",Running,CBS,"In Watson a year after the death of his friend and partner Sherlock Holmes at the hands of Moriarty, Dr. John Watson resumes his medical career as the head of a clinic dedicated to treating rare disorders. Watson's old life isn't done with him, though — Moriarty and Watson are s…",,English,60,2025
The Walking Dead: The Ones Who Live,2024/02/25,2024/03/31,6.0,"[""Drama"", ""Action"", ""Horror""]",Ended,AMC,"The Walking Dead: The Ones Who Live presents an epic love story of two characters changed by a changed world. Kept apart by distance. By an unstoppable power. By the ghosts of who they were. Rick and Michonne are thrown into another world, built on a war against the dead... And…",,English,60,2024
The Walking Dead: Daryl Dixon,2023/09/10,,7.4,"[""Drama"", ""Action"", ""Horror""]",Running,AMC,"The Walking Dead: Daryl Dixon is a spinoff series set in The Walking Dead Universe that centers around the eponymous character. Daryl washes ashore in France, raising the ire of a splintered but growing autocratic movement centered in Paris and endangering a young boy at the hea…",AMC+,English,,2023
Bookie,2023/11/30,2025/01/30,7.8,"[""Comedy""]",Ended,HBO Max,"A veteran bookie struggles to survive the impending legalization of sports gambling, increasingly unstable clients, family, co-workers, and a lifestyle that bounces him around every corner of Los Angeles, high and low.",HBO Max,English,,2023
Riches,2022/12/02,,5.0,"[""Drama""]",To Be Determined,Prime Video,"Riches follows the exploits of the stylish, privileged, super-successful Richards family. When Stephen Richards passes suddenly, the family's world comes crashing down. As his business hangs in the balance, his different sets of children are about to collide as they vie for cont…",Prime Video,English,,2022
Roommates of Poongduck 304,2022/10/13,2022/11/03,7.0,"[""Drama"", ""Romance""]",Ended,Heavenly,"As a third-generation chaebol and undoubted future heir to the Guemman Group, Ji Ho Joon was raised with the world at his feet. Now a happy-go-lucky twenty-something, Ho Joon doesn't have a care in the world. Certain he's destined to live the privileged life forever, Ho Joon is…",Heavenly,Korean,,2022
Chicken Nugget,2024/03/15,2024/03/15,4.5,"[""Comedy"", ""Mystery""]",Ended,Netflix,"A woman steps into an odd machine and becomes... a chicken nugget?! Now, it's up to her father and admirer to embark on a zany quest to bring her back.",Netflix,Korean,,2024
Urusei Yatsura,2022/10/13,,7.0,"[""Comedy"", ""Anime"", ""Romance"", ""Science-Fiction""]",Running,Fuji TV,"Tokyo. Tomobiki Town.Lum, the gorgeous daughter of an invading race of Oni Aliens is smitten with High School student Ataru Moroboshi.A dedicated womanizer, Ataru is unfazed by Lum's fierce electric shock attacks and continues his daily hunt for pretty girls.With a host of other…",,Japanese,30,2022
The Expanse: One Ship,2021/12/10,2022/01/07,7.8,"[""Science-Fiction""]",Ended,Prime Video,"An anthology of short webisodes of The Expanse, all relating to the Doctrine of One Ship - that there is only one ship, and it has countless parts as a single body has countless cells.",Prime Video,English,,2021
A Shoulder to Cry On,2023/03/14,2023/03/29,6.8,"[""Drama"", ""Romance""]",Ended,Viki,"At school, Lee Da Yeol spends most of his time living as an outsider. Not popular by any stretch of the imagination, Dae Yeol's only real joy comes from his time spent with the archery club. A talented archer whose skills have earned him a scholarship to the school, Dae Yeol doe…",Viki,Korean,,2023
C*A*U*G*H*T,2023/09/28,,6.6,"[""Comedy"", ""War""]",To Be Determined,Stan,"C*A*U*G*H*T follows four Australian soldiers sent on a secret mission to a war-torn country. Mistaken for Americans, they are captured by freedom fighters and produce a hostage video that goes viral. When the soldiers reach celebrity status, they realize that being caught might…",Stan,English,,2023
Ninja Express,2021/06/30,2021/10/25,6.2,"[""Comedy"", ""Children""]",Ended,VRT MAX,"Imagine a delivery service that delivers anything, anywhere and anytime. Now imagine it being run by three little Ninjas with incredible powers!",VRT MAX,Dutch,11,2021
Gyeongseong Creature,2023/12/22,2024/09/27,6.6,"[""Drama"", ""Action"", ""Horror""]",Ended,Netflix,"Gyeongseong, 1945. In Seoul's grim era under colonial rule, an entrepreneur and a sleuth fight for survival and face a monster born out of human greed.",Netflix,Korean,,2023
Hotel Cocaine,2024/06/16,,7.1,"[""Drama"", ""Action"", ""Crime""]",Running,MGM+,"Hotel Cocaine is set in the 1970s and early ‘80s Miami drug trade. It follows Cuban exile and CIA operative Roman Compte, who runs The Mutiny Hotel.",,English,60,2024
King the Land,2023/06/17,2023/08/06,6.9,"[""Comedy"", ""Romance""]",Ended,jTBC,"Set in the backdrop of a hotelier's dream, the VVIP business lounge 'King the Land', it depicts the story of a man who cannot withstand a fake smile and a woman who always has to smile brightly.",TVING,Korean,70,2023
NieR:Automata Ver1.1a,2023/01/07,,7.4,"[""Anime""]",Running,Tokyo MX,"Animated adaptation of NieR: Automata (2017), where a long-running war on post-apocalyptic Earth between androids and machines soon unveils the truth of the world.",,Japanese,30,2023
García!,2022/10/28,2022/11/25,5.6,"[""Action"", ""Science-Fiction"", ""Thriller""]",Ended,HBO Max,"In a present-day Spain, divided and on the brink of political chaos, inquisitive millennial investigative reporter Antonia stumbles on a decades-old conspiracy: the existence of a cryogenically frozen super-agent, García, created in a laboratory in the 1950s by General Franco's…",HBO Max,Spanish,,2022
Gang Zielonej Rękawiczki,2022/10/19,,7.0,"[""Comedy"", ""Crime""]",To Be Determined,Netflix,"When their latest heist goes wrong, three older female burglars evade officials by hiding out in a nursing home — where they uncover a sinister secret.",Netflix,Polish,,2022
Leopard Skin,2022/11/17,2022/11/17,6.4,"[""Drama"", ""Comedy"", ""Crime""]",Ended,Peacock,"Fleeing a botched diamond heist, a criminal gang seeks shelter in the remote paradise of Playa Perdida, Mexico in the beachside estate of two women, Alba and Batty. Dark and humorous complications arise when they are joined by two dinner guests (TV producer Max and his flighty g…",Peacock,English,,2022
The Walk-In,2022/10/03,2022/10/03,6.4,"[""Drama""]",Ended,ITVX,"Based on real events, The Walk-In follows an activist and his advocacy group as they confront an extremist organisation.",ITVX,English,,2022
See You in My 19th Life,2023/06/17,2023/07/23,7.3,"[""Drama"", ""Comedy"", ""Romance""]",Ended,tvN,"See You In My 19th Life is a spirited love story that comes back to life between Ban Ji Eum, who has the extraordinary ability to remember her past lives, and Moon Seo Ha, whom she is destined to meet. Ban Ji Eum has no attachments to her previous lives, but when she loses Moon…",TVING,Korean,70,2023
A Time Called You,2023/09/08,2023/09/08,7.9,"[""Crime"", ""Fantasy"", ""Romance""]",Ended,Netflix,"A grieving woman magically travels through time to 1998, where she meets a man with an uncanny resemblance to her late love.",Netflix,Korean,,2023
Love to Hate You,2023/02/10,2023/02/10,7.6,"[""Drama"", ""Comedy"", ""Romance""]",Ended,Netflix,A romantic comedy drama in which a woman who doesn't want to lose pathologically to a man and a man who pathologically suspects a woman are healed through war-like love.,Netflix,Korean,,2023
Island,2022/12/30,2023/03/10,6.8,"[""Fantasy"", ""Mystery""]",Ended,TVING,"Based off of a popular webtoon series of the same name, Island tells the story of a group of people who are fated to save the world by facing off against an ominous force on the island of Jeju.Won Mi Ho is the only daughter of her father who runs Daehan Group. Her arrogant and s…",TVING,Korean,,2022
Hit Bite Love,2023/01/21,,6.6,"[""Comedy"", ""Romance""]",To Be Determined,Amarin TV,"Love vs Make Love: Ken and Shokun are secretly dating but they must keep it a secret. After a long time, Shokun—who yearns for status—becomes dissatisfied and desperately wants to disclose their relationship publicly. They finally break up. Soon, Shokun starts a new relationship…",,Thai,60,2023
Si lo hubiera sabido,2022/10/28,2022/10/28,6.8,"[""Drama"", ""Comedy"", ""Romance""]",Ended,Netflix,"Emma is a 30-year-old woman who is disappointed with her ten-year marriage to Nando and her family life, who feels that her life has lost its luster. Trapped in a routine without any romance or excitement, she realizes that if she could go back in time, she would not accept Nand…",Netflix,Spanish,,2022
Конец света,2022/10/27,2022/12/08,7.4,"[""Comedy"", ""Fantasy""]",Ended,КиноПоиск,"Our days. A brutal, bloody murder is taking place in central Moscow, for which there is no rational explanation; the only true version is that Satan himself came to earth.",КиноПоиск,Russian,,2022
